,Message
59,"У соцмережах поширюють частину відео з вирваною з контексту цитатою  Цитату Байдена взяли з його виступу на конференції Палати представників Демократичної партії у Філадельфії ще в березні 2022 року  Як пояснюють фактчекери VoxCheck, Байден чітко говорить про те, що військова агресія Росії проти України не переросте у Третю світову війну  Далі він зазначає, що подібне можливо за умови, якщо спільно зі зброєю США відряджатимуть в Україну американських спеціалістів  Саме цю частину промови й використали для маніпуляції Російська пропаганда й раніше поширювала меседж, що в Україні триває Третя світова  Цей меседж використовують зокрема й для пояснення тривалості та невдач так званої «спеціальної воєнної операції» — мовляв, Росія воює не лише з Україною, а з «колективним Заходом»"
60,"Частину відео справді було знято в Києві, частину — в Х’юстоні (США) ще у 2017 році  Відео із Х’юстона у 2020 році використовували як «доказ» наслідків тайфуну «Молаве» у В’єтнамі  Міграція великої кількості птахів не має жодного стосунку до конспірології чи «сатанинських ритуалів»  Як пояснюють фактчекери Myth Detector, така поведінка птахів називається мурмурація  Науковці вважають мурмурації способом захисту від хижаків або обміну інформацією про сприятливі місця годування  Такі маніпуляції агітпропу підживлюють меседжі про «знищення» церкви Московського патріархату, потребу в «десатанізації» України, яка пропагує язичництво  Російська пропаганда навмисно розділяє українців за віросповіданням задля посилення внутрішніх суперечок та ще більшої дестабілізації ситуації в Україні"
61,"Ситуація з електропостачанням у Закарпатській області справді складна  У деяких населених пунктах Хустського району Закарпатської області справді два дні поспіль було безперебійне електропостачання, тоді як в решті міст і сіл світло подавали за графіком  Це викликало невдоволення місцевих мешканців  Про ситуацію розповіли у статті на сайті ЗакарпатПост 29 січня  Як пишуть фактчекери StopFake, місцева влада пообіцяла розібратись чому виникла така ситуація та відновити електропостачання у всіх населених пунктах за графіком  Про те, що влада навмисно «переспрямувала» електрику зі  шкіл та дитячих садків і «віддала» її базам відпочинку, не йшлося  Це безпідставна вигадка пропагандистів, оскільки вимкнення відбуваються не точково по об’єктах, а певними лініями Поширюючи такі меседжі, російські пропагандисти намагаються знецінити роботу українських енергетиків та працівників, що забезпечують роботу критичної інфраструктури  Показати неспроможність влади розв'язувати енергетичні питання  Раніше агітпроп поширював меседжі: що Україна відновлює експорт електроенергії, і саме через це людям вимикають світло, що Київ — єдине місто «колишньої України», де за допомогою Заходу швидко відновлюють енергопостачання  Також українців намагались розділити, поширюючи меседж, що одесити без світла, бо «їхню електроенергію віддали на Захід України» Раніше «Детектор медіа» пояснював як російська армія і пропаганда намагаються знищити енергетичну систему України"
62,"Російські ЗМІ поширюють  новини зпосиланням на статтю в американському виданні Newsweek під назвою «Битва за український титан», де справді обговорюється перспектива інвестування американськими компаніями в розроблення родовищ цього стратегічно важливого, зокрема для виробництва зброї, металу Також у статті йдеться про те, що Росія, хоча і не називала серед приводів длявійни захоплення родовищ українського титану, отримає стратегічну перевагу,якщо контролюватиме видобуток на окупованих територіях  Від російського титану ізараз залежить США, і через це не накладає санкції на олігархів, які володіютькомбінатами з видобування та перероблювання титанової руди   І захоплення українських родовищ можепідсилити цю залежність Але в статті не йдеться проте, що США підтримали Україну у війні саме через поклади титану  Йдеться лишепро те, що  після закінчення війниамериканські інвестори могли б вкластися в розроблення таких родовищ  Водночас Росія,яка веде  загарбницьку війну, могла надумку авторів статті,  прикриваючись  вигаданими причинами, мати на меті йзахоплення українських ресурсів"
63,
64,
65,
66,"Американський літак Boeing E-3 Sentry, який використовують для дальнього радіолокаційного виявлення, справді нещодавно прибув до Румунії  Він моніторитиме російську військову активність на східному кордоні НАТО  «Операції з захоплення території Заходу України» — вигадка агітпропу  Як зазначає StopFake, саме російська агресія та повномасштабне вторгнення в Україну змусили НАТО посилити безпекові заходи на своєму східному кордоні Російська пропаганда постійно просуває наратив, що Польща має намір захопити Захід України  Раніше в межах цього наративу пропагандисти розповідали, що Польща вважає Захід України своєю «колонією»  Також агітпроп поширював фейки про референдум щодо приєднання Заходу України до Польщі та переконував, що Захід України віддадуть Польщі, якщо Варшава виплатить США борг замість Києва"
67,"Міжнародні організації, зокрема МАГАТЕ, Агентство ООН з навколишнього середовища, Науковий комітет з ризиків для здоров'я та навколишнього середовища Комісії ЄС дійшли загального висновку, що вплив радіоактивного випромінювання збідненого урану несуттєвий  Радіаційне опромінення від збідненого урану дуже низьке у порівнянні з природною радіацією  За результатами медичних обстежень військовослужбовців, які використовували такі снаряди під час бойових дій, не виявили впливу збідненого урану на стан їхнього здоров’я Російська пропаганда веде інформаційну кампанію з дискредитації німецьких та американських танків, які планують відрядити в Україну  Раніше вони стверджували, що ці танки не змінять ситуацію на фронті  Мовляв, американські танки Abrams непридатні для використання в Україні взимку  Також стверджували, що Росія вважатиме Німеччину «стороною конфлікту», якщо буде дозвіл постачати в Україну танки  Детальніше"
68,"Держпродспоживслужба справді поширила інформацію про печиво румунського виробництва, в якому знайшли підвищений вміст акриламіду  Такі повідомлення поширювали по всій Україні, ба більше — в інших країнах також  Як пояснює Харківський антикорупційний центр, Україна, як і інші держави, отримала попередження про небезпечний продукт через європейську систему швидкого оповіщення для харчових продуктів та кормів (Rapid Alert System for Food and Feed – RASFF) та поінформувала людей про це  ХАЦ зазначає, що немає інформації про те, чи ця марка печива взагалі продавалась на Харківщині Тобто пропагандисти використали повідомлення про потенційну небезпеку для сіяння паніки серед харків’ян  Мовляв, гуманітарну допомогу або не видають, або пропонують небезпечні продукти"
69,"Відео, яке використовують пропагандисти, не дає підстав робити узагальнювальні висновки щодо можливості використання танків в Україні  Як зазначають фактчекери проєкту The Insider, у соцмережах є відеозаписи зимових навчань за участі танків Abrams, зокрема у 2016 році в Норвегії  На відео видно як танки Abrams без жодних проблем  пересуваються глибоким снігом і зледенілою дорогою, а при швидкому спуску зі снігового пагорба один із них  демонструє  прийом екстремального водіння — керований занос  Представниця Пентагону Сабріна Сінгх на брифінгу повідомила, що досі танки Abrams не надіслали Україні тому, що вони вибагливі в обслуговуванні й потребують авіаційного палива  У такий спосіб пропагандисти намагаються переконати аудиторію, що будь-які поставки західної зброї жодним чином не вплинуть на воєнний хід подій  Також пропагандисти намагаються зірвати поставки німецьких танків Leopard"
70,"На сайті Харківської ОВА, опублікована інформація щодо надання гуманітарної допомоги населенню  Зокрема, протягом попереднього тижня (16-22 січня) у громади області передали близько чотирнадцяти тисяч продуктових наборів  На сайті Координаційного гуманітарного центру розміщено мапу для відстеження гуманітарної допомоги населенню  Як зазначає Харківський антикорупційний центр, проблеми з отриманням гуманітарної допомоги в деяких населених пунктах деокупованих територій справді можуть бути  Однак, російська пропаганда спотворює реальний стан справ, зокрема, щодо гуманітарної допомоги від ООН  У ній були матраци, постільна білизна, сонячні лампи, посуд, засоби гігієни та інші побутові речі, а не продукти, як стверджували пропагандисти У такий спосіб пропагандисти намагаються створити ілюзію того, що Україна не лише не допомагає людям на деокупованих територіях, ба більше — влаштовує «пекло для цивільних»  Мовляв, людей заарештовують за організацію спортивних заходів чи випікання хліба під час окупації; не видають гуманітарну допомогу та карають за її отримання від окупантів"
71,"Швейцарський чиновник нічого не говорив про відмову Швейцарії передавати Україні заморожені російські активи  Ба більше — міністр закордонних справ Швейцарії Ігнаціо Кассіс в інтерв'ю виданню Tages-Anzeiger підтвердив, що підтримує ідею конфіскації заморожених російських коштів та їх використання для відновлення України  Фактчекери StopFake зазначають, що наразі кошти українській стороні не передають через відсутність відповідної правової бази, проте це питання вже обговорюється низкою країн У такий спосіб агітпроп підживлює наратив про те, що Україна слабка держава, яка не переможе у російсько-українській війні  Також такими повідомленнями пропагандисти намагаються деморалізувати бойовий дух українців та стимулювати західні держави не  надсилати Україні зброю"
72,"Як пише StopFake, в інтерв’ю телеканалу ARD Зеленський розповідав, що Німеччина і досі не може ухвалити рішення щодо постачання Україні танків Leopard  А також сказав, що рішення окремої однієї країни  дати чи не  дати десяток танків не може вплинути суттєво на перебіг війни: «Коли вони (росіяни) мають тисячу танків, жоднакраїна рішенням, що вони нам дають 10 танків, 20 танків, 50 танків, не вирішуєпроблему  Але вони роблять одну дуже важливу річ: вони мотивують наших воїнівборотися за їхні цінності, тому що показують, що весь світ — з тобою», — сказав Зеленський Тобто йшлося про рішення одної країни, зокрема Німеччини, надати чи не надати танки Україні  Слова Зеленського є відповіддю на часті висловлювання Олафа Шольца, що Німеччина не може надавати Україні важку зброю через те, що боїться стати «стороною конфлікту»  У такий спосіб Зеленський відповідав саме на слова Шольца, що рішення Німеччини справді  суттєво  не вплине на перебіг війни, але на це впливають рішення десятків країн-союзників України, і саме колективні зусилля (зокрема щодо надання Україні танків), допоможуть виграти війну  І навіть відомо, скільки саме потрібно Україні танківдля повернення окупованих після 24 лютого територій: в інтерв'ю виданню TheEconomist головнокомандувач Збройних сил України Валерій Залужний сказав, щодля цього потрібно 300 танків, близько 700 БМП та 500 гаубиць  Маніпулюючи словами Зеленського російська пропаганданамагається переконати аудиторію, що Україна не зможе виграти війну поприбудь-яку допомогу західних партнерів, і тим самим вплинути на суспільнінастрої в Україні"
73,
74,
75,"Фахівці проєкту StopFake пояснили, що насправді у коментарі данському виданню Berlingske військовий аналітик  Крістіан Крістенсен висловив занепокоєння з приводу того, що заміну 19 гаубицям Caesar знайти буде нелегко через реалії сучасного ринку зброї  Проте експерт не говорив, що рішення данського уряду передати Україні гармати є помилкою і що Данія «пошкодувала» про цей крок  Тобто такої офіційної позиції країни не було  Хоч і експерт наголошував у своїх працях на те, що гаубиці — важливий елемент в оборонній здатності країни  Пропагандисти поширюють цю маніпуляцію, щоб підживити наратив про те, що надаючи зброю Україні, інші країни залишаються без нічого та стають слабкими  У такий спосіб пропагандисти хочуть стимулювати західні держави не надсилати Україні зброю"
76,
77,"Насправді ж у такий спосіб рідні військовослужбовців, які потрапили у полон, вимагали обміняти полонених за схемою «всіх на всіх»  Цю подію висвітлювали українські медіа У повідомленнях пропагандисти згадували й про військовослужбовців, які вважаються зниклими безвісти  Однак, робили акценти на тому, що нібито більшість цих військових загинула, а командування ЗСУ «навмисно» не повідомляє цього рідним  Маніпулювали й розподілом українців за регіоном проживання  Мовляв, мешканці Заходу України не розуміють чому їхні рідні повинні воювати за Донбас Російська пропаганда використовує емоційно вразливий стан українців, чиї рідні перебувають на фронті, щоб ще більше дестабілізувати внутрішню ситуацію в Україні  Раніше пропагандисти вже розповідали, що нібито українська влада бреше, що в ЗСУ немає втрат, хоча ЗСУ втрачають людей «наліво і направо в інтересах Заходу  Для посилення ефекту пропаганда поєднує ці меседжі із меседжами про мобілізацію, мовляв, Офіс президента її посилює  Детальніше"
78,"По-перше, хоч наказ про мобілізацію й підписує президент, але всі мобілізаційні заходи належать до ведення ЗСУ  По-друге,  загальна мобілізація триває в Україні з 24 лютого, не зупинялася та востаннє була подовжена в листопаді 2022 року до 18 лютого 2023 року  По-третє, як повідомилив Київській міській держадміністрації, такі  оголошення — звичайне інформуваннянаселення  «ТЦКСП мають право доводити до громадянінформацію про планові заходи  Це звичайна робота ТЦКСП  Не варто сприймати такі оголошення в іншому контексті», а також додають, що оголошенняна під’їздах будинків — це «інформуваннянаселення про те, що мобілізаційний процес в країні триває та нагадування длятих, кому вже були вручені повістки, з’явитися до військкомату»  В КМДА не пояснили, чому саме ці оголошення з’явилисялише в одному районі столиці Раніше кремлівська пропаганда неодноразово поширювала фейки про мобілізацію в Україні"
